{
  "scene_id": "scene_1",
  "environment_type": "kitchen",
  "suggested_tasks": [
    {
      "task_id": "scene_1::pick::mug",
      "task_name": "Pick up the mug",
      "task_type": "pick",
      "target_object": "mug",
      "task_complexity": "atomic",
      "curriculum_split": "pretrain",
      "required_camera_ids": ["left", "right", "wrist"],
      "difficulty": "easy",
      "priority": 1,
      "requires_object_motion": true,
      "description_hint": "Pick up the mug"
    }
  ],
  "robot_config": {
    "type": "franka",
    "base_position": [0.0, 0.0, 0.0],
    "workspace_bounds": [
      [0.0, 0.0, 0.0],
      [1.0, 1.0, 1.0]
    ]
  }
}
